评分,评论内容,评论时间,商品规格,平台,来源文件
1,送给婆婆的新手机，她特别喜欢，手机实物更好看，而且语音唤醒可以直接调节字体，她操作很容易上手，照片拍摄效果也不错！,2025年12月28日,"{'机身颜色': '星光蝴蝶结', '套餐类型': '官方标配', '存储容量': '12GB+256GB'}",未知平台,商品4.csv
1, 手机收到了，真的好快，昨天下单今天就收到了，而且客服也特别的好，在直播间下单的，以前我不敢在直播间下单，以为都是骗人的，很多人都是这样认为的，然后我很担心，我就问客服，客服说没事的，不可能的。确实是的，天猫 OPPO 旗舰店值得信赖的。以后我有需要还会再来买的,2026年1月11日,"{'机身颜色': '星光蝴蝶结', '套餐类型': '官方标配', '存储容量': '16GB+512GB'}",未知平台,商品4.csv
1,像素很好，送的礼物🎁也很多，目前的使用情况算是很满意的，速度流畅,2025年12月22日,"{'机身颜色': '星光蝴蝶结', '套餐类型': '官方标配', '存储容量': '16GB+1TB'}",未知平台,商品4.csv
1,物流很快，服务很好，产品给力哦,2026年1月3日,"{'机身颜色': '星光蝴蝶结', '套餐类型': '官方标配', '存储容量': '16GB+512GB'}",未知平台,商品4.csv
1,算得上是白月光了，线下店看了后，更喜欢了，不打游戏，单纯喜欢拍照和这颜值。,2026年1月3日,"{'机身颜色': '星光蝴蝶结', '套餐类型': '官方标配', '存储容量': '16GB+512GB'}",未知平台,商品4.csv
1,挺好的旧旧手机拍的不清晰 实物非常好看 功能什么都正常 第二个oppo手机还是很满意的,2025年12月27日,"{'机身颜色': '星光蝴蝶结', '套餐类型': '官方标配', '存储容量': '12GB+512GB'}",未知平台,商品4.csv
1,机身轻薄，星光白配色温润高级，后盖不易沾指纹；512GB大存储空间充裕，日常应用与多任务流畅，ColorOS系统动画细腻；拍照色彩讨喜，人像模式自然，快充回血快,2025年12月27日,"{'机身颜色': '星光蝴蝶结', '套餐类型': '官方标配', '存储容量': '12GB+512GB'}",未知平台,商品4.csv
1,非常满意非常喜欢特别好用质感也还不错像苹果手机一样下次还会再来购买哦,2026年1月10日,"{'机身颜色': '星星粉', '套餐类型': '官方标配', '存储容量': '12GB+512GB'}",未知平台,商品4.csv
1,心心念念的可露丽棕，喜欢   很低调  不喜欢玻璃背板的  一摔就碎   可露丽棕是我的菜   赠的耳机也不错   经济实惠  好用不贵    用了很多年OPPO了  支持  ,2026年1月2日,"{'机身颜色': '可露丽棕', '套餐类型': '官方标配', '存储容量': '12GB+512GB'}",未知平台,商品4.csv
1,手机收到啦，比想象中的还要好看，极光蓝很高级，非常惊艳，而且系统很流畅，拍照两亿像素，很清晰，实况出圈功能真的好好看啊,2026年1月2日,"{'机身颜色': '可露丽棕', '套餐类型': '官方标配', '存储容量': '12GB+256GB'}",未知平台,商品4.csv
1,这款手机外观时尚，轻薄便携拿在手上很舒服。性能强劲运行流畅，游戏、办公都不在话下。拍照效果出色，色彩还原度高。电池续航持久，性价比超高值得买。,2026年1月2日,"{'机身颜色': '星光蝴蝶结', '套餐类型': '官方标配', '存储容量': '12GB+512GB'}",未知平台,商品4.csv
1,发货比较快，客服态度很好！很耐心！手机不错，新手机反应速度快，拍照像素也不错！一直是oppo.的老用户了！用了很多个oppo手机了！,2025年12月21日,"{'机身颜色': '星光蝴蝶结', '套餐类型': '官方标配', '存储容量': '12GB+256GB'}",未知平台,商品4.csv
1,颜值党狂喜！OPPO Reno15星光蝴蝶结款太绝了，超薄机身手感超棒，日常单手握持毫无压力。天玑8450性能在线，玩游戏不卡顿，2亿像素主摄拍照清晰，续航一天一充够用，学生党、上班族闭眼冲！,2025年12月21日,"{'机身颜色': '星光蝴蝶结', '套餐类型': '官方标配', '存储容量': '12GB+512GB'}",未知平台,商品4.csv
1,该用户觉得商品非常好，给出5星好评,2025年12月21日,"{'机身颜色': '星光蝴蝶结', '套餐类型': '官方标配', '存储容量': '12GB+256GB'}",未知平台,商品4.csv
1,太喜欢了，手感超棒，小屏的设计超棒，超好看，使用起来很流畅,2025年12月26日,"{'机身颜色': '星光蝴蝶结', '套餐类型': '官方标配', '存储容量': '12GB+512GB'}",未知平台,商品4.csv
1,玻璃机身，挺小巧的，女生单手就能拿着无障碍打字。,2025年12月26日,"{'机身颜色': '星光蝴蝶结', '套餐类型': '官方标配', '存储容量': '12GB+512GB'}",未知平台,商品4.csv
1,新手机收到啦，OPPOReno15，白色的背后还有亮亮的蝴蝶结图案，非常的漂亮。6.32英寸的小屏也是非常的适合女生使用呢，手机拍照也很清晰，还有手机的系统也是非常的流畅呢，毕竟OPPO的系统也是有口皆碑。而且这次还赠送了代言人宋雨琦的周边礼盒，带有宋雨琦联名款ccd真是很不错呢！,2025年12月26日,"{'机身颜色': '极光蓝', '套餐类型': '官方标配', '存储容量': '12GB+256GB'}",未知平台,商品4.csv
1,✨这款手机通信音质真的好惊喜呀~📞通话时声音清晰稳定，就算在嘈杂环境也能听清对方讲话，完全没有杂音和卡顿呢！💯描述也很相符，整体使用感超棒，推荐入手哦~😊,2026年3月4日,"{'机身颜色': '星光蝴蝶结', '套餐类型': '官方标配', '存储容量': '12GB+256GB'}",未知平台,商品4.csv
1,非常好用的手机，颜值在线，界面很舒服。,2026年3月3日,"{'机身颜色': '星星粉', '套餐类型': '官方标配', '存储容量': '16GB+512GB'}",未知平台,商品4.csv
1,不错，颜色很好看，用起来速度也快，主要参加国补便宜400多,2026年3月3日,"{'机身颜色': '极光蓝', '套餐类型': '官方标配', '存储容量': '12GB+256GB'}",未知平台,商品4.csv
1,手机使用挺好的。绐给个五星好评。之前囚田用的只是6.8的屏，现在手机感觉小巧一些，如手机的操作系统用的还不熟悉。写汗评论时无时代无法尼改动,2026年3月1日,"{'机身颜色': '可露丽棕', '套餐类型': '官方标配', '存储容量': '12GB+256GB'}",未知平台,商品4.csv
1,手机很漂亮，处理器，天机 845有点低,2026年2月27日,"{'机身颜色': '极光蓝', '套餐类型': '官方标配', '存储容量': '12GB+512GB'}",未知平台,商品4.csv
1,抱着试一试的心态没想到出乎我的意料简直不要太完美值得入手,2026年2月27日,"{'机身颜色': '星光蝴蝶结', '套餐类型': '官方标配', '存储容量': '12GB+512GB'}",未知平台,商品4.csv
1,✨这次购物体验一般呢~续航能力用着就是普通水平😐，拍照效果也只是一般般，没有特别惊艳的地方🙂。运行速度日常使用还算顺畅，但也没到畅快的程度😌。整体和描述的基本符合吧，没有太惊喜也没有很失望~,2026年1月8日,"{'机身颜色': '极光蓝', '套餐类型': '官方标配', '存储容量': '12GB+256GB'}",未知平台,商品4.csv
0,入手就是为了拍照，结果使用过后不太理想，拍摄时电量掉的很快，送的耳机比较不错，抗造,2026年1月8日,"{'机身颜色': '极光蓝', '套餐类型': '官方标配', '存储容量': '12GB+512GB'}",未知平台,商品4.csv
1,✨这次购物体验超棒！手机颜值完全戳中我心，星光蝴蝶结配色温柔又灵动，拿在手里像握着小礼物🎀。性能也很惊喜，日常使用流畅不卡顿，续航一整天下来还有余电🔋。发货速度超快，包装也很精致，拆开时满满的仪式感🌟。总之是很满意的一次购物，推荐给大家～💖,2025年12月15日,"{'机身颜色': '星光蝴蝶结', '套餐类型': '官方标配', '存储容量': '12GB+256GB'}",未知平台,商品4.csv
1,手机外观特别好看，我好喜欢，内存大，音质好，像素真的不错，这款手机是不错的选择 通信音质：好   ,2025年12月15日,"{'机身颜色': '星光蝴蝶结', '套餐类型': '官方标配', '存储容量': '12GB+256GB'}",未知平台,商品4.csv
1,对比了好久的手机，终于买了，oppo一直是长期用的手机，再次选购，大品牌，品质有保障。,2025年12月25日,"{'机身颜色': '可露丽棕', '套餐类型': '官方标配', '存储容量': '12GB+256GB'}",未知平台,商品4.csv
1,OPPO Reno15一经上手，便觉体验感拉满，宛如给生活按下了“美好记录键”。 外观设计独具匠心，极光蓝配色清新又耐看，冷雕玻璃背板搭配金属中框，拿在手中质感满满却又不会有压迫感，187g的轻盈重量，放在兜里毫无负担。6.32英寸的小直屏尺寸恰到好处，极窄四等边设计带来舒适的视觉享受，边缘滑动也不会割手。 影像能力是一大亮点，2亿超清影像搭配出圈实况功能，随手一拍就能记录生活中的氛围感瞬间，让青春、状态与心情都能被完美留存。 性能方面同样出色，天玑8450芯片动力强劲，ColorOS系统操作丝滑流畅，内置的小布助手还能记住常用设置，十分贴心。而且它通过了IP68 + IP69双认证满级防水，哪怕手机洒上水或者不慎掉入水里也无需担忧。 不过，它的80W快充在同价位中稍显逊色。但总体而言，OPPO Reno15凭借出色的外观、优秀的影像和实用的功能，依然是一款值得入手的手机。,2025年11月27日,"{'机身颜色': '星光蝴蝶结', '套餐类型': '官方标配', '存储容量': '12GB+512GB'}",未知平台,商品4.csv
1,手机和苹果一样大小，外观漂亮，实体店还有二百优惠店铺优惠，网上没有，国补五百线上线下都一样，手机不卡顿很好用，好评,2026年2月23日,"{'机身颜色': '星光蝴蝶结', '套餐类型': '官方标配', '存储容量': '16GB+256GB'}",未知平台,商品4.csv
1,手机的物流速度特别快 运行速度和拍照都很好 拍照试了一下也很可以！,2025年12月31日,"{'机身颜色': '极光蓝', '套餐类型': '官方标配', '存储容量': '12GB+512GB'}",未知平台,商品4.csv
1,还可以 OPPO的外观真的做得很漂亮 用起来也是挺丝滑的，声音也很大 ,2025年12月31日,"{'机身颜色': '星光蝴蝶结', '套餐类型': '官方标配', '存储容量': '12GB+256GB'}",未知平台,商品4.csv
1,物流快，包装好，送货上门，旧手机同时回收，国补+旧换新省了近500块。 手机颜值高，工艺考究，软硬件设计都很人性化，拿在手里很有分量。 客服回应很及时，很详细，态度很友好。,2026年2月22日,"{'机身颜色': '可露丽棕', '套餐类型': '官方标配', '存储容量': '16GB+256GB'}",未知平台,商品4.csv
1,老天爷太好看了这个白色 买给妈** 结果自己喜欢上了！真的好好看 ！！！,2026年2月22日,"{'机身颜色': '星光蝴蝶结', '套餐类型': '官方标配', '存储容量': '12GB+512GB'}",未知平台,商品4.csv
1,理想中的手机 很好用 就是电池续航不咋地,2026年2月21日,"{'机身颜色': '星光蝴蝶结', '套餐类型': '官方标配', '存储容量': '16GB+512GB'}",未知平台,商品4.csv
1,手机质感不错，就是是塑料的，整体有点轻飘飘。镜头不错，屏幕颜色整体差了点。 送的赠品也多，耳机音质挺不错的。音响也还可以。,2026年1月7日,"{'机身颜色': '极光蓝', '套餐类型': '官方标配', '存储容量': '16GB+512GB'}",未知平台,商品4.csv
1,这款手机外观特别好看，简约时尚的设计，握在手里很有质感。使用起来极其流畅，程序切换没有丝毫卡顿。拍照也清晰，真的很值得入手。,2025年12月24日,"{'机身颜色': '星光蝴蝶结', '套餐类型': '官方标配', '存储容量': '16GB+1TB'}",未知平台,商品4.csv
1,好貌美的手机！蝴蝶结超级美丽，赠品也很好看！使用起来很流畅，就是掉电有点快，但是充电也很快,2025年12月24日,"{'机身颜色': '星光蝴蝶结', '套餐类型': '官方标配', '存储容量': '16GB+512GB'}",未知平台,商品4.csv
1,✨实物和描述完全一致呢，星光蝴蝶结配色特别仙，拿在手里颜值超高~🌟存储容量也很够用，日常拍照存文件都没问题，使用起来特别流畅~💯物流也很快，下单没几天就收到了，包装得很仔细，没有任何破损，整体体验超满意！😊,2026年1月6日,"{'机身颜色': '星光蝴蝶结', '套餐类型': '官方标配', '存储容量': '16GB+256GB'}",未知平台,商品4.csv
1,该用户未填写评价内容,2026年1月6日,"{'机身颜色': '星光蝴蝶结', '套餐类型': '官方标配', '存储容量': '12GB+512GB'}",未知平台,商品4.csv
1,非常满意的一次购物，物有所值，比实体店里实惠多了！先说商品质量：产品总体不错，包装严实。再说商家服务：点赞啦。最后点评快递：发货很快。,2026年2月16日,"{'机身颜色': '星星粉', '套餐类型': '官方标配', '存储容量': '12GB+256GB'}",未知平台,商品4.csv
1, OPPO Reno15真的把颜值和实用焊死了！裸眼3D蝴蝶结+星光镜组太戳审美，高亮冰透玻璃握在手里像揣着块果冻海，金属中框质感拉满，小直屏单手操作无压力，放小包包里也不占地～手机颜值很高，外附加了很多赠品，性价比超高，这款手感非常的合适。,2025年12月18日,"{'机身颜色': '星光蝴蝶结', '套餐类型': '官方标配', '存储容量': '12GB+512GB'}",未知平台,商品4.csv
1,手感特别好，颜值又高，手持着很舒服，续航挺长的，80w快充也很方便，运行流畅不卡顿，挺好哒😊,2025年12月23日,"{'机身颜色': '极光蓝', '套餐类型': '官方标配', '存储容量': '16GB+512GB'}",未知平台,商品4.csv
1,下单后发货迅速，物流信息更新及时，快递包装完好无损。客服态度热情友好，回复及时专业，有问必答，购物体验超棒！😘 ,2025年12月23日,"{'机身颜色': '星光蝴蝶结', '套餐类型': '官方标配', '存储容量': '16GB+1TB'}",未知平台,商品4.csv
1,手感很不错，颜值也特别高，白色特别适合女生用 ，超级满意！！！！客服的态度也很好，速度也很快,2025年12月23日,"{'机身颜色': '星光蝴蝶结', '套餐类型': '官方标配', '存储容量': '12GB+512GB'}",未知平台,商品4.csv
1,质感很棒！用起来也很顺手！尺寸正好！性价比很高！蝴蝶结款式也很好看！推荐！,2025年12月29日,"{'机身颜色': '星光蝴蝶结', '套餐类型': '官方标配', '存储容量': '16GB+512GB'}",未知平台,商品4.csv
1,当初也是看了几个品牌的相近价位的，最终还是选了颜值➕拍照性能于一体的Reno15，他的摄像头区域还有细闪，蝴蝶结设计非常少女心，完全就是很难忘掉，不买会后悔的那种，大小也贼合适，拍照功能强大，好像后置能放大120倍，贼牛，清晰度很高，目前没有任何问题，而且快递很快，第二天上午我就收到了，快递员也很负责，包装箱完好无损,2025年12月13日,"{'机身颜色': '星光蝴蝶结', '套餐类型': '官方标配', '存储容量': '12GB+256GB'}",未知平台,商品4.csv
1, 信号满格 用起来非常方便 颜值也很看。声音好听 画质舒服 绝了！,2026年1月5日,"{'机身颜色': '星光蝴蝶结', '套餐类型': '官方标配', '存储容量': '12GB+256GB'}",未知平台,商品4.csv
1,手机很漂亮，小直屏握感很舒适，拍照的效果很好，很好看😄😄😄😄😄😄😄😄,2026年1月25日,"{'机身颜色': '星星粉', '套餐类型': '官方标配', '存储容量': '16GB+512GB'}",未知平台,商品4.csv
1,用了一段时间，电池很耐用，粉色的外壳颜值很高，非常喜欢,2026年1月25日,"{'机身颜色': '星星粉', '套餐类型': '官方标配', '存储容量': '12GB+256GB'}",未知平台,商品4.csv
1,机型美观大方，质量也很好，拍照清晰，功能，网速不卡，超级满意,2026年1月13日,"{'机身颜色': '星光蝴蝶结', '套餐类型': '官方标配', '存储容量': '12GB+256GB'}",未知平台,商品4.csv
1,好喜欢好喜欢 非常貌美的小手机 实况也好棒呀 真的很有质感  拍照超级清晰 很美丽哦 超级无敌喜欢 内存也完全足够了,2025年12月22日,"{'机身颜色': '星光蝴蝶结', '套餐类型': '官方标配', '存储容量': '12GB+256GB'}",未知平台,商品4.csv
1,我买的最新款星星粉，真的好看，是淡淡的粉色，新手机用起来就是流畅。拍照也很清晰,2026年1月4日,"{'机身颜色': '星星粉', '套餐类型': '官方标配', '存储容量': '12GB+512GB'}",未知平台,商品4.csv
1,这个尺寸是小屏的，女生手比较小拿着很适合，然后就是很多都和🍎系统很像，苹果转安卓也比较好适应,2026年1月3日,"{'机身颜色': '星光蝴蝶结', '套餐类型': '官方标配', '存储容量': '12GB+512GB'}",未知平台,商品4.csv
1,好用，第一次买OPPO手机，拿在手里和我这个vivo手机重量没差别，而且这款手机要比我这个vivo要小巧一些，对于我们这种小手人士来说真的很友好,2026年1月3日,"{'机身颜色': '星光蝴蝶结', '套餐类型': '官方标配', '存储容量': '16GB+1TB'}",未知平台,商品4.csv
1,建议大家购买，用起来还不错,2025年12月27日,"{'机身颜色': '星光蝴蝶结', '套餐类型': '官方标配', '存储容量': '12GB+256GB'}",未知平台,商品4.csv
1,还不错，客服态度很好，手机像素也很好，手机比较精致，很喜欢，给好评！,2025年12月27日,"{'机身颜色': '极光蓝', '套餐类型': '官方标配', '存储容量': '12GB+256GB'}",未知平台,商品4.csv
1,挺漂亮的款式，可惜没有国补，16G+1T的内存共用几年了，第一次在淘宝平台买手机，这次很不错！,2025年12月27日,"{'机身颜色': '星光蝴蝶结', '套餐类型': '官方标配', '存储容量': '16GB+1TB'}",未知平台,商品4.csv
1,外观惊艳手感佳，拍照清晰续航强，屏幕色彩亮丽，系统流畅不卡顿，性价比高。,2025年12月21日,"{'机身颜色': '星光蝴蝶结', '套餐类型': '官方标配', '存储容量': '12GB+512GB'}",未知平台,商品4.csv
1,"发货速度快，物流很快，拍照很清晰，拼图功能也好用,有国补优惠很多，还送了赠品，学生还送充电宝，电量也禁用",2025年12月7日,"{'机身颜色': '星光蝴蝶结', '套餐类型': '官方标配', '存储容量': '12GB+256GB'}",未知平台,商品4.csv
1,是正品新机，一直都在用OPPO ，旧的那台内存不够用 ，所以这次就换了大内存 的，新手机外观漂亮 ， 运行快 ，拍照又清楚 又漂亮， 通信音质清亮，很满意,2026年2月7日,"{'机身颜色': '星光蝴蝶结', '套餐类型': '官方标配', '存储容量': '12GB+512GB'}",未知平台,商品4.csv
1,这款手机最开始吸引到我的地方就是它的拍照，一拍二拼三出圈，简直就是出圈神器。再加上最新款星星粉配色，简直不要太好看。,2026年1月2日,"{'机身颜色': '星星粉', '套餐类型': '官方标配', '存储容量': '12GB+512GB'}",未知平台,商品4.csv
1,“用OPPO Reno15拍夜景真的很出色，画面干净噪点少。平时刷视频、逛淘宝都很顺畅，续航足够用一整天。颜值高，手感轻，很适合出门携带。”,2025年12月26日,"{'机身颜色': '星光蝴蝶结', '套餐类型': '官方标配', '存储容量': '12GB+256GB'}",未知平台,商品4.csv
1,该用户未填写评价内容,2025年12月15日,"{'机身颜色': '星光蝴蝶结', '套餐类型': '官方标配', '存储容量': '12GB+256GB'}",未知平台,商品4.csv
1,"第一次购买oppo,这款手机非常实惠，像素品质也非常好，妈妈非常喜欢，客服态度也非常好。",2025年12月15日,"{'机身颜色': '极光蓝', '套餐类型': '官方标配', '存储容量': '12GB+256GB'}",未知平台,商品4.csv
1,下单后很快就收到了，星光蝴蝶结很精美。电池容量也很足。适合拍照片哦~,2025年12月20日,"{'机身颜色': '星光蝴蝶结', '套餐类型': '官方标配', '存储容量': '12GB+512GB'}",未知平台,商品4.csv
1,✨手机续航真的很惊喜，重度使用一天还剩不少电呢🔋！拍照效果也超赞，色彩还原度高，拍风景拍人都清晰好看📸。运行速度特别流畅，切换APP完全不卡顿，用起来太舒心啦🚀。整体使用体验很棒，很满意这次的购买～😊,2025年12月20日,"{'机身颜色': '星光蝴蝶结', '套餐类型': '官方标配', '存储容量': '12GB+256GB'}",未知平台,商品4.csv
1,物流没话说，一大早就送来了，手机使用非常丝滑，特别是拍照，很清晰，外观也很漂亮🤩，推荐,2026年2月5日,"{'机身颜色': '星光蝴蝶结', '套餐类型': '官方标配', '存储容量': '12GB+256GB'}",未知平台,商品4.csv
1,还是第一次用oppo的手机，机身很小巧精致，使用顺滑。送的礼盒挺漂亮的。拍照刷网耗电有点快，看小说和待机的时候又比较正常。,2025年12月10日,"{'机身颜色': '星光蝴蝶结', '套餐类型': '官方标配', '存储容量': '12GB+256GB'}",未知平台,商品4.csv
1,好看，外观绝了，拍照也好看，刷视频刚开始有点模糊，需要去把设置里面的视频长续航模式关了就不模糊了，耗电中规中矩，充电从1充满需要1个小时，手机玩多了还是会发烫,2025年12月10日,"{'机身颜色': '星光蝴蝶结', '套餐类型': '官方标配', '存储容量': '12GB+256GB'}",未知平台,商品4.csv
1,通信音质： 其他特色：通信音质：很好 运行速度：很快 显示效果：很好 其他特色：不错。 显示效果：非常好，用起来很方便，物美价廉  宝贝收到了，和描述一样，很喜欢非常满意的一次购物，产品外观和质量都很棒，物流速度快，商家服务专业。外观和质量都很满意，物流速度快，商家服务专业，性价比高，推荐购买。,2025年11月29日,"{'机身颜色': '星光蝴蝶结', '套餐类型': '官方标配', '存储容量': '12GB+512GB'}",未知平台,商品4.csv
1,✨收到手机真的超惊喜！礼盒包装精致大气，配件齐全又好看🎁。手机壳透明设计很简约，上面的花纹也很有质感💫。续航能力很好，充满电用一天完全没问题🔋。拍照效果清晰，色彩还原度高，运行速度也很畅快，用起来特别顺手👍。整体体验非常棒，很满意这次的购买~😊,2025年11月29日,"{'机身颜色': '星光蝴蝶结', '套餐类型': '官方标配', '存储容量': '12GB+512GB'}",未知平台,商品4.csv
1,外观好看，手感不错,2026年1月1日,"{'机身颜色': '星光蝴蝶结', '套餐类型': '官方标配', '存储容量': '12GB+512GB'}",未知平台,商品4.csv
1,哇塞，送的东西都好好看，物流也很快，全新的手机，都是送达验货的,2026年1月1日,"{'机身颜色': '星星粉', '套餐类型': '官方标配', '存储容量': '12GB+256GB'}",未知平台,商品4.csv
1,手机收到了，很好，很漂亮，送了照相机和音响。,2026年1月1日,"{'机身颜色': '星光蝴蝶结', '套餐类型': '官方标配', '存储容量': '12GB+256GB'}",未知平台,商品4.csv
1,✨极光蓝真机比图片还好看！🌌 后盖在阳光下像流动的星河，颜值直接戳中我～💫 开机速度很快，日常用完全不卡顿，续航也很顶，重度使用一天还剩30%电🔋 整体超满意，这个价格太值啦！😊,2026年1月1日,"{'机身颜色': '极光蓝', '套餐类型': '官方标配', '存储容量': '12GB+512GB'}",未知平台,商品4.csv
-1,实话实说，手机用着不错，就是掉电太快了，感觉有点后悔买了，,2026年1月9日,"{'机身颜色': '可露丽棕', '套餐类型': '官方标配', '存储容量': '12GB+256GB'}",未知平台,商品4.csv
1,该用户未填写评价内容,2025年12月25日,"{'机身颜色': '星光蝴蝶结', '套餐类型': '官方标配', '存储容量': '12GB+256GB'}",未知平台,商品4.csv
1,用习惯了oppo   买的是reno15  用起来感觉很不错  增加了很多新的功能  像素也好  手感也好好  总之就是很喜欢🤗,2025年12月14日,"{'机身颜色': '星光蝴蝶结', '套餐类型': '官方标配', '存储容量': '12GB+512GB'}",未知平台,商品4.csv
1,被Reno15的全能圈粉！小直屏单手好握持，3.5倍潜望长焦拍远照超稳，4K实况互传7秒速发，IP69防水日常用着超省心～,2025年12月31日,"{'机身颜色': '星光蝴蝶结', '套餐类型': '官方标配', '存储容量': '12GB+512GB'}",未知平台,商品4.csv
1,好评，给父母买的，已经买了第二个手机了，物美价廉，赠品也不错。,2025年12月31日,"{'机身颜色': '星光蝴蝶结', '套餐类型': '官方标配', '存储容量': '12GB+256GB'}",未知平台,商品4.csv
1,物流挺快的，手感不错，触屏可以。直接没问题,2026年1月8日,"{'机身颜色': '星星粉', '套餐类型': '官方标配', '存储容量': '12GB+512GB'}",未知平台,商品4.csv
