评论,分数,产品,名字
一直想给妈妈换一个手机，趁着双12手机打折，找到这款小米K80。价格很优惠，买到后迫不及待的开机，使用体验还不错，多用几天看看效果。,5,已购 山峦青 12GB+256GB,0***2
现在红米还是有性价比的，虽然我不买了，但是给老人家买，还是很不错的。堆料小米没输过谁。2k屏幕，骁龙8gen3，ip68防水，都是可以的,5,已购 汐月蓝 12GB+256GB,坚强的猪先生
一直在京东买手机，没出过问题，红米k80应该是这个价位性价比最高的了，用久一点没问题，一年两年以后小米换电池比较方便,5,已购 玄夜黑 12GB+256GB,罪与罚1993
红米K80性价比拉满！骁龙8 Gen3+2K护眼直屏流畅丝滑，6550mAh大电池+90W快充告别电量焦虑，金属中框质感在线，日常用机、游戏都靠谱,5,已购 雪岩白 12GB+256GB,梁浩天
非常不错的一次购物体验商品活动，商品质量非常好，不愧为京东自营平台上的小米大厂家生产的正品行货。手机性能卓越，设计精美，适用性高，性价比高，真心值得拥有，快递小哥很给力，亲自上门服务到家，值得点赞👍🏻,5,已购 山峦青 16GB+1TB,秋天枫叶FY
红米K80，2K屏蛮清晰的，电池可以的 ，中度使用6小时也就消耗了百分之60的电，一天一充可以的，90W的充电速度很快,5,已购 玄夜黑 12GB+256GB,陈***n
手机很快收到了，给朋友买的，她喜欢，喜欢比啥都重要，手感看着不错，颜值高用起来也顺手，新机很可以的，不错,5,已购 山峦青 12GB+256GB,j***g
12+256，第三代骁龙8处理器速度很快，下载速度也很快。1600多性价比很高。屏幕挺大的，5600多mah电池容量够大。,5,已购 雪岩白 12GB+256GB,我i我佳521
手机手感还不错，系统还是之前的小米系统，性价比挺高，主要还是价格实惠，我都是买隔代的，实惠，总体来说，不错,5,已购 汐月蓝 12GB+256GB,王宝王宝
性价比很高k八零过补之好价格很划算作为日常手机使用性能完全符合要求充电量大然后照片也清晰。给老妈换个手机，加上果脯很划算，大家可以重点考虑一下。京东物流也很给力下单当日就到。,5,已购 汐月蓝 16GB+256GB,jd小喇叭滴滴
"外形外观：外观很好看
拍照效果：拍照非常好，清晰，色彩鲜艳
运行速度：运行速度很快
下单就发货，价格实惠，有国补很划算，很满意",5,已购 汐月蓝 12GB+256GB,棉***6
双十一购买的k80，原本纠结k80至尊或k90，最后综合考虑后选的k80，另外两个有大R角颜值高，但小米之家体验后实在是太宽了，反而k80修长握感更佳，整体性价比更高，原本觉得后面的圆形摄像头有点丑，但真机其实还可以，加上金属中框，后盖两段式玻璃设计挺不错，性能方面除了照相感觉跟旗舰机没太大区别，这次小米澎湃系统升级3.0后，整体提升明显，小爱同学也升级为超级小爱，Ai方面有很大提升。,5,已购 汐月蓝 16GB+512GB,张伟king
已经记不清这是第几次购买小米的产品了。上部手机用了三年半，感觉还不错。但是电池不太给力了。这款也不错。性价比也不错。,5,已购 汐月蓝 16GB+1TB,R***W
红米的手机性价比这一块拉满，老妈的手机坏了给他刚买了一个k80 性能够用，算上国补到手1500多块钱，真心不错,5,已购 雪岩白 12GB+256GB,大波19890822
小米红米大品牌，一直用红米K系列的手机，非常好用，速度快，系统硬件优化得非常好！之前用K20，现在都不卡！,5,已购 汐月蓝 12GB+512GB,y***6
红米手机特别好用，是给父母买的刚刚给爸爸买了一个很好用然后又下单了一个给妈妈买的外放声音也很大使用很喜欢待机时间也很长充电速度快手感舒适,5,已购 雪岩白 12GB+256GB,酸奶味的长颈
买手机都习惯性在京东上买 之前用的是小米k70 不小心摔坏了就又买了这个k80 昨天晚上买的 今天早上10点多就送到了 速度是挺快的 小米换机速度也挺快的 刚开始用 应该不错,5,已购 玄夜黑 16GB+256GB,可爱的小小余
红米k80这个外观还是很不错的，特别喜欢这个蓝色，拍照很好看，充电速度：12分钟从83度电充到97度。,5,已购 汐月蓝 12GB+256GB,jd_zc3p3pkvt475eq
红米k系列手机，名副其实的物美价廉。多年来，一直钟情于K系列手机，从K30PRO一直买到K80手机，优秀的手机系统，获得了非常棒的使用体验。点赞！推荐！,5,已购 山峦青 12GB+256GB,jd_海涯创意
哦，价格很实惠，赶上果宝的尾巴，小米品牌值得信赖，大家一起快冲吧，系统流畅不卡顿骁龙八加芯芯片，它带给你澎湃动力了解,5,已购 雪岩白 12GB+256GB,中国奥斯卡影帝新秀
红米K80至尊版太香了！天玑9400+性能强劲，游戏满帧不卡顿，144Hz高刷屏丝滑流畅，7410mAh大电池续航超强，100W快充回血快。金属中框质感高级，IP68防水、对称双扬、超声波指纹一应俱全，同价位性价比拉满，物流快包装严实，非常满意！,5,已购 云杉绿 12GB+256GB,x***5
这手机玩游戏真不错，性能拉满，无卡顿，上分首选，屏幕大，视觉效果好，震动带感，玩王者荣耀不怎么发热，照相，看视频也可以，必定是性能机。放心买。,5,已购 月岩白 12GB+256GB,看***买
Redmi K80至尊，体验远超预期！天玑9400+处理器配合独显D2芯片，玩《和平精英》144帧丝滑无比，散热也压得住。7410mAh的超大电池是最大惊喜，重度使用一天还有余电，彻底告别充电宝。1.5K 144Hz直屏显示清晰，支持全亮度DC调光很护眼。金属中框+IP68防水防尘，还有超声波指纹、对称双扬和超宽频马达，这个价位给的太足了，性价比之王！,5,已购 冰锋蓝 16GB+512GB,会员79363
买来给我爸用的，颜色非常合我心意，磨砂手感，拍照也非常不错，有特色，处理器对我爸来讲很够用，主要是喇叭我觉得很棒，这也是这款手机的亮点所在，总体来讲就是非常适合我爸，是一款很不错的手机,5,已购 砂岩灰 12GB+256GB,c***h
还行，大小合适，目前用着挺顺滑，就是第一次充电就发热得很，续航的话，用的比较少，一天下来就是100-80这样，数据转移蛮好的，原来的设置基本全搬过来了,5,已购 砂岩灰 12GB+256GB,k***1
给孩子换的手机，配置、性能足够用了。玩游戏很赞，画面清晰。送货很快，第二天就送到了，还能用国补。手机充电速度很快。目前使用良好。,5,已购 冰锋蓝 12GB+512GB,晓萱225
手机性价比高。电池很耐用。这款手机的电池有7000多毫安两电一充都不要紧。而且用起来也很流畅，跑分分数也很高。值得入手。,5,已购 月岩白 12GB+256GB,蒋***师
物流很快，包装很好，打开手机试了一下各项功能正常，标识和系统符合购买要求，屏幕够大能调整字体大小，适合岁数大点的人用，使用一段时间后看看效果，再追评。,5,已购 砂岩灰 16GB+512GB,南波061
太好看了吧，这真的超级的喜欢，作为一个备用机真的超级好用，要不是我有主机了，真的可以心头爱了，运行超级流畅，而且手感嘎嘎好，喜欢喜欢,5,已购 砂岩灰 12GB+256GB,小北呀呀北北
使用了，才来评价的确实不错，运行的很流畅，听说还要涨价赶紧买一台当备用机，两千不到的价格确实很棒，玩游戏，刷视频都很流畅，下次再来。,5,已购 云杉绿 12GB+256GB,n***_
选了好久终于选择了小米k80至尊版，上现在入手性价比超好，加上超长续航的电池，天玑9400芯片，D2独显芯片，运行绝大多数游戏都流畅自如！拍照功能也很强大！,5,已购 云杉绿 16GB+512GB,jd_爆裂都市
家里老人之前用的小米9，好多年了，已经卡的不好用了。由于习惯了小米系统，这次买了这个红米k80，512g内存的，应该能用几年了。,5,已购 月岩白 12GB+512GB,i***p
用了一段时间了，本来要买华为的，我儿子说买这个款，用着也可以，容量都很大，就是我用着有点大，应该习惯就好了，别的都挺好,5,已购 月岩白 12GB+512GB,xiangxiang1981
"以旧换新：直接买新的嗯
外形外观：挺不错的的，值得购买推荐
屏幕音效：音效一级棒！手推！
拍照效果：拍照还行，
运行速度：特别不错不错
待机时间：这个非常不错的嘛
其他特色：马达和音响！再加超高性价比！特别不错值得推荐购买！",5,已购 月岩白 12GB+512GB,j***E
买给老妈的手机，因为价格实在太便宜了，必须买给老人用，内存买个大的，然后电池很大，可以用很久才充电，充电速度也快，系统很流畅，拍照够用了。神机。,5,已购 月岩白 12GB+512GB,L***N
✨手机图案雅致，设计很有韵味呢。系统很流畅，用着还挺好的，好在快递包装严实，送货速度也快，配送员服务态度也好👍。希望下次商品质量能更有保障呀～,5,已购 月岩白 12GB+512GB,小可乐罐儿
小米的手机性价比一直很高，这次换手机果断又入手小米，大小合适，颜值很高，重量合适合，还是一如既往的满意，会继续支持！,5,已购 月岩白 12GB+512GB,jd_fjhh349
"外形外观：白色很喜欢，很有那种青春感
屏幕音效：杜比全声音量，很有那种打游戏的氛围感
拍照效果：拍照清晰，没有杂质，IP 68防水",5,已购 月岩白 12GB+512GB,u_th7pwadtap3g
这款手机手感极佳，屏幕显示细腻色彩饱满，拍照效果惊艳，续航持久，系统流畅不卡顿，性价比超高，强烈推荐！,5,已购 月岩白 12GB+512GB,初濑伊纲_
这款旗舰机堪称全能选手，卫星通信功能实用性拉满，拍照色彩还原真实细腻，续航撑满全天无压力。机身握持感舒适，系统流畅丝滑，大内存应对多任务也不卡顿，商务、日常、摄影需求全满足，贵有贵的道理。,5,已购 月岩白 12GB+512GB,j***k
补贴后价格非常合适，不愧性价比之王，之前给爱人买了一个，使用不错，自己也换一个，从屏幕大小和清晰度，运行速度，充电速度，续航这几个方面说，完全能满足我的使用需求。好评！,5,已购 月岩白 12GB+512GB,文武1105
物流很快，手机用起来很棒，拍照很清晰，不卡顿，一直是米粉一直用的小米手机，那我给你转了，这次是给家里人买的，家里人很喜欢期待后续使用体验哦,5,已购 冰锋蓝 12GB+256GB,齐咕隆咚锵
用了一段时间了，本来要买华为的，我儿子说买这个款，用着也可以，容量都很大，就是我用着有点大，应该习惯就好了，别的都挺好,5,已购 月岩白 12GB+512GB,xiangxiang1981
拍照很清晰，电池很好用。很耐用，很流畅。很好很不错。自拍有美颜，外放，声音清晰。赠送充电器。很不错各类软件游戏流畅运行不卡的。,5,已购 月岩白 12GB+256GB,藥屋貓貓
这款手机使用体验非常流畅，屏幕清晰，拍照效果出色。电池续航能力强，满足日常需求。总体而言，性能稳定，性价比高，值得推荐。,5,已购 砂岩灰 12GB+256GB,-***-
红米K80至尊版12+256G月岩白太香了！白色颜值干净高级，玻纤背板手感细腻不沾指纹，金属中框质感在线。天玑9400+性能强劲，游戏满帧不发烫，144Hz高刷屏顺滑护眼。7410mAh大电池续航超强，一天一充无压力，100W快充回血快。拍照清晰，日常够用，系统流畅不卡顿。256G存储足够用，性价比拉满，同价位几乎无短板，白色耐看又好用，非常推荐！,5,已购 月岩白 12GB+256GB,24d896sczn4rei
给家人买的，一直用这个品牌的手机，好用，小米值得信赖。物流这次有点小插曲，但是最后处理的还算满意，所以还是五星好评。,5,已购 冰锋蓝 16GB+512GB,i4kt9n80l3klcx
给孩子换的手机，配置、性能足够用了。玩游戏很赞，画面清晰。送货很快，第二天就送到了，还能用国补。手机充电速度很快。目前使用良好。,5,已购 月岩白 12GB+256GB,u***1
棒棒哒 手机很不错 刷新率蛮高的 使用过程中很丝滑棒棒哒棒棒哒 最开始买这个手机的时候其实期待值不是很高 也是抱着试一试的态度 买回来之后拆机,5,已购 冰锋蓝 12GB+256GB,8g0r08yi4ltutx
去线下店看过实物很喜欢，但是这款目前实体店都没货了，转战线上对比了几家平台，京东是最便宜的，国补可以直接使用，太方便了，以后买数码还会来京东。,5,已购 砂岩灰 12GB+512GB,kq2i3knc647cx0
包装完好，没有磕碰什么的，而且价格也非常实惠，下次还会再来购买呢，非常喜欢的一款手机，用个一两年也没问题的，下次再回购。希望舒服,5,已购 冰锋蓝 12GB+256GB,冲***烂
Redmi K80至尊版太香了！天玑9400+性能强劲，游戏满帧不发烫，7410mAh大电池续航超强，144Hz高刷屏顺滑护眼，金属中框质感扎实，同价位性价比拉满，日常使用非常舒服。,5,已购 月岩白 12GB+256GB,n8g6f1zsmbk34u
手机质量很好，屏幕清晰度高，运行速度快。卖家服务态度很好，有问必答。发货速度很快，包装完好无损。非常满意这次购物体验！,5,已购 云杉绿 16GB+512GB,鲲宝暴富
第一次买小米的，用起来还很顺手 ，操作流畅，启动快，充电快，外放声音大又好听，机型也是我想要的，很不错,5,已购 冰锋蓝 12GB+512GB,寒***1
这款手机白色的颜色很喜欢电池容量很大可以两天一充。这款手机的跑分也很高。用起来比较流畅的值得拥有一下子买了两个给家人也一个我自己用一个。,5,已购 月岩白 12GB+256GB,蒋***师
用了几天才来评论，手感非常好，价格不贵，根本够用，比一万多的还好用，物流非常快，第一部小米用六那是儿子还没有出生,5,已购 砂岩灰 16GB+512GB,jd_zhang3738
手机电池特别耐用，手机性能也比较好，就是昨天刚买的手机，今天就发现手机壳掉漆了。,3,已购 月岩白 12GB+256GB,BGrPUjmEzuvg
一直支持红米，非常实惠，适合我这种经济不富裕的人，但是手机功能齐全，画质清晰，运行流畅！,5,已购 砂岩灰 16GB+512GB,你***干
给老爸买的手机，用着挺顺手的，说还不错，很丝滑，待机时间也挺长，价格也合适，很好用,5,已购 冰锋蓝 12GB+512GB,张***丫
跟好用，待机时间长，运行速度特别快，拍照也很好看，一直喜欢红米这个牌子，值得信赖,5,已购 月岩白 12GB+256GB,付***7
发货很快 早上买下午到 给家里人买的 一下子买了几部 很适合 好操作 会回购 外观很好看 买的灰色很高级,5,已购 砂岩灰 12GB+256GB,Y***Z
这手机拍照简直无敌，屏幕显示效果超惊艳，手感细腻贴合，成像清晰自然，太香了！推荐！,5,已购 月岩白 16GB+1T,tQCLupWjZtBt
"屏幕音效：很好，听歌很清晰，还可以听音乐，还有音乐。
拍照效果：清晰
运行速度：反应流畅
待机时间：大容量电池，待机时间长
其他特色：有国补，立马下单了，立即优惠二三百。",5,已购 冰锋蓝 12GB+256GB,飞***2
挺好用的，值得购买，性能很强，玩游戏很快，内存很大，以后再也不用担心内存的事情了，这是我拍的两张照片,5,已购 冰锋蓝 12GB+512GB,Young-福至
这次手机也从苹果换成了红米，特地使用了几天再来评价。颜值够高，做工够细，内存够大，速度够快，操作够畅，显示够靓，系统够顺，屏幕够大。惊喜多多，优惠多多，物超所值,5,已购 月岩白 12GB+256GB,颜兰兰
选了好久最终入手K80 Ultra，果然没失望。性能强劲，多开应用也丝滑，散热做得不错。屏幕清晰护眼，144Hz刷新率看着舒服。续航不错，不过没有想象的那么耐用，IP68防水也实用。外观简约大气，细节做工扎实，这个价位能有这样的配置，真的物超所值，虽然商品有点小瑕疵，但售后也给解决了。推荐给注重实用性的朋友！,5,已购 月岩白 12GB+256GB,jeffrey1211
手机漂亮，与介绍的一样，照片超清晰，通话也很清楚。这款用着超级好，算是千元机里面我感觉最好的啦，不卡顿，看视频、玩游戏非常流畅，颜色鲜艳，喜欢喜欢特别喜欢，我全家一直都是使用这个牌子手机。,5,已购 砂岩灰 12GB+256GB,jd_tprbyg88iw268h
物流很快，手机屏幕很好，震动马达劲很大，外放很不错，手机系统很流畅，卡顿bug情况很少，整体值得推荐,5,已购 月岩白 16GB+256GB,j***m
手机很好用，买给小孩的。那个小孩用这个手机显得绰绰有余，用来学习读的英语，看看其他的什么学习软件非常的快，并且屏幕看起来也很柔和。电池电量大，两三天都不用充电。,5,已购 砂岩灰 16GB+1T,果***多
"挺好的，性价比很高的，手机就是能用就行，拍照，内存可以就行。不需要太贵。
拍照效果：效果很好，图片清晰。运行速度快。用三四年可以的。",5,已购 砂岩灰 16GB+256GB,jd_0vq1432wmqnfc2
"以旧换新：直接买新的嗯
外形外观：挺不错的的，值得购买推荐
屏幕音效：音效一级棒！手推！
拍照效果：拍照还行，
运行速度：特别不错不错
待机时间：这个非常不错的嘛
其他特色：马达和音响！再加超高性价比！特别不错值得推荐购买！",5,已购 月岩白 12GB+512GB,j***E
质量还不错，续航时间长普通使用可以用三天，性能可以，日常使用完全没问题。自带的这个手机壳磨砂质感挺好的，,5,已购 云杉绿 12GB+256GB,克***斯
这款小米至尊版手机，款式好看，性能很好，颜值又高，声音够大，手感不错，买给儿子非常喜欢，爱不释手。加上价格适中，性价比极高。,5,已购 冰锋蓝 16GB+256GB,一亩地123
"外形外观：小米的外观不错，都是长在我的审美上的。
屏幕音效：声音没问题，外放声音也够大，小喇叭
拍照效果：拍照够用了，没什么问题。
运行速度：速度可以，搭载天玑9400+",5,已购 月岩白 12GB+256GB,G***愿
反正国补的力度确实非常大，嗯，京东的平台比其他的平台好像更便宜，整个屏幕是很大的，然后外壳是金属材质的，看起来比较有质感，给老人用应该是比较合适的。,5,已购 云杉绿 12GB+256GB,jd_12ojw8pv9cpo1y
红米k80性价比很高的一款手机，电池耐用，屏幕显示高清，参与国补买的很实惠，使用起来很流畅不卡顿，推荐了朋友同事购买，非常满意的一次购物~~,5,已购 月岩白 12GB+256GB,俄罗斯天空
很不错的一部手机，不管是外观，性能，尺寸，手感都挺喜欢的，趁着双十一活动入手了，价格很不错，虽然没买到最低价，但是这个价格比那些首发入手的省了几百块，用了一个月出头了，各方面都挺满意的,5,已购 云杉绿 12GB+256GB,鸿***6
买了第五天摄像头起两个泡,3,已购 云杉绿 12GB+512GB,j***j
用了几天下来体验感拉满，运存可以提升到32g，屏幕刷新率也是144hz，太酷啦，拍照夜景效果也是十分不错的了，外放音质真的是最赞的，感觉很立体，很清澈，很nice!,5,已购 砂岩灰 12GB+256GB,豆宝慢慢长
手机非常好，外形非常的好看，摄像头也非常的好看，屏幕也非常的亮，音效也非常的不错，拍照的效果还是挺好的，运行起来也非常的流畅，一点也不卡,5,已购 月岩白 12GB+256GB,说***听
这屏幕真的太适合熬夜党了！2K分辨率看着超细腻，120Hz高刷屏滑动丝滑，关键是护眼模式效果贼好，晚上躺床上刷小说，眼睛一点都不酸胀，打工人表示爱了！,5,已购 月岩白 16GB+256GB,jd_156306weg
原来的旧手机电池不行了，乘着年底买一个给新。的妈妈买的手机，性价比很高，大屏，大电池，充电也快，老人家臭，这性能绰绰有余了。,5,已购 月岩白 16GB+256GB,半空鱼
整体体验还不错，电池续航和内存表现符合预期，日常使用很流畅。美中不足的是拍照效果一般，光线暗的地方画质有点差。作为千元机，满足基本需求没问题，要是拍照能再提升就更好了,5,已购 月岩白 12GB+256GB,j***6
冲着大电池买的，屏幕抽奖不知道是哪家的，续航还行，对得起电池容量，第一次用天玑处理器，感受不到和高通的差距。,5,已购 月岩白 16GB+512GB,real7262
外围配置很高，马达和声音太赞了，拍照也很清晰，超声波指纹解锁很快。系统体验蛮好的我个人现在用下来，没有遇到卡顿或错误。后盖设计我非常喜欢，个人觉得很精致好看,5,已购 月岩白 12GB+256GB,任意路
"外形外观：设计大气典雅别致时尚
屏幕音效：声音很大，很适合老人使用
拍照效果：拍照日常绝对够用了
运行速度：日常使用绰绰有余，性能优良",5,已购 冰锋蓝 16GB+256GB,jd_156092bixb
小米手机是正品，用着很流畅，手感很好，拍照很清晰小米手机真是不错，正品保证，系统流畅不卡顿，手感舒适，拍照效果清晰，日常使用完全够用，推荐购买！,5,已购 月岩白 16GB+1T,5***r
红米 K80 至尊版 天玑9400+ 7410mAh大电池 冰锋蓝 12GB+512GB 5G手机，京东商城活动时购买。操作系统流畅，配置硬件设施高，充电速度快，手感不错，音效不错。,5,已购 冰锋蓝 12GB+512GB,神行太保zzh
上手就能很明显感受到马达的高级，比我手中上代至尊震感明显大，R角的屏幕看着也很舒服，都说这个可能比较重，但像我这种上代至尊用惯了感觉差不多。,5,已购 砂岩灰 12GB+256GB,j***年
感觉还可以，使用原装充电器的话充电速度挺快，系统用上最新版的也还是挺流畅的。用了一段时间，各种软件运行也不错的。,5,已购 砂岩灰 12GB+256GB,数***7
屏幕比原来的青春版要宽一点儿，看视频更舒服，运行速度快，主要是容量大，内存够用，电池容量大，不用用充电了，朋友推荐的，性价比还是挺高的,5,已购 云杉绿 12GB+256GB,轩***米
非常满意的手机，性价比特别高，音效比之前强多了，买来打游戏体验感非常的高，电池容量也特别大，推荐购买,5,已购 月岩白 12GB+256GB,非同一般的6
外观和果子很像，很有质感，澎湃OS优化良好，速度快运行流畅&quot;拍照表现：5000万像素主摄，拍照效果很不错。,5,已购 冰锋蓝 16GB+512GB,春***1
"外形外观：外观时尚，颜色漂亮，受众群体高，买给老人使用的
运行速度：芯片比较好，运行速度快，用个三五年没问题，",5,已购 砂岩灰 12GB+256GB,初夏浅唱
用了一段时间，挺不错的，就是手机宽，应该是为了打游戏好，用起来很流畅，挺不错的，电池续航也还行吧。不错不错。。。,5,已购 冰锋蓝 16GB+512GB,等等-看看
一如既往的优秀，作为红米的的忠实用户，上个手机是k40陪伴了我四年，现在k80出来就换了至尊，手感拍照打游戏各方面都很好，太喜欢了,5,已购 月岩白 12GB+256GB,30133vpk7ejcej
买给老妈的手机，因为价格实在太便宜了，必须买给老人用，内存买个大的，然后电池很大，可以用很久才充电，充电速度也快，系统很流畅，拍照够用了。神机。,5,已购 月岩白 12GB+512GB,L***N
入手这款手机有一段时间了，感觉彻底被它的表现征服！玩《原神》《星穹铁道》运行蛮好的，最惊艳的是大电池，中度使用一天一充完全可以，彻底告别电量焦虑。,5,已购 月岩白 12GB+256GB,数***7
用起来挺不错，挺喜欢的,3,已购 月岩白 16GB+512GB,jd_fje8i5a5vyjhou
到货很快，顺丰发货，包装完整没有破损，未激活未拆封，安全下车，系统运行流畅，操作灵敏响应快不卡顿，摄像头拍照清晰好看像素高。,5,已购 月岩白 12GB+256GB,j***1
冲着k80至尊版的音质和价格入手的，1T版加上各种折扣到手2800多，性价比挺高的。音质的确很好，调整成dts 3d音效，堪比小音箱。震动反馈也很棒。希望能用的久点,5,已购 月岩白 16GB+1T,j***m
"红米k70pro换到k80至尊版很不错，升级电池和屏幕宽度。
使用后感觉续航比之前高了很多，屏幕看起来比之前大了很多，但是手握尺寸没有感觉变大",5,已购 冰锋蓝 16GB+1T,团子丶小脑瓜
说真的红米K80的续航我能吹爆！6550mAh大电池不是摆设，周末出门逛街拍照刷视频，一整天下来电量还有剩，再也不用揣着充电宝到处跑，对懒人来说简直是福音！,5,已购 月岩白 16GB+256GB,jd_156306weg
物品收到，发货迅速，包装完好。小米K80 pro手机质量不错，运行流畅，电池容量大，屏显分辨率高，拍照视频像素完美，非常满意。,5,已购 砂岩灰 12GB+256GB,可爱的鼻子
红米K80至尊版太绝啦!天玑9400+芯片性能强劲，玩游戏不发烫。7410mAh大电池超耐用，屏幕清晰护眼，日常使用再合适不过~👍,5,已购 砂岩灰 12GB+256GB,梦里周游列国
